"Средняя зарплата","published_at","salary_from Замена","salary_to Замена","дата без времени","id","name","has_test","response_letter_required","salary_currency","created_at","parsed_at","url","employer_name","description","alternate_url","area_id","area_name","salary_from Заменен","salary_to Заменен","salary_gross"
"145000","2021-02-15 15:51:21+00","110000","180000","","42398304","Системный аналитик/ Бизнес-аналитик разработка высоконагруженного ПО","","","RUR","2021-02-15 15:51:21+00","2021-02-16 03:10:31.326165+00","https://api.hh.ru/vacancies/42398304?host=hh.ru","Retail Personal","<p>В крупную компанию разработчика ПО для госсектора требуется системный аналитик:/ бизнес-аналитик. </p> <p> Высоконагруженное ПО работает 24/7 . </p> <p><strong>Обязанности:</strong></p> <ul> <li>Анализ текущих решений, проведение обследований, выявление технических требований и их формализация, управление изменениями, документирование</li> <li>Сбор и формализация требований путём интервьюирования и изучения исходных проектных материалов</li> <li>Комплексный анализ технологических процессов / задач автоматизации проекта (на бизнес и технологическом уровне), построение моделей процессов / моделей данных / моделей информационных потоков и т.д. (AS IS и TO BE)</li> <li>Взаимодействие с техническими специалистами заказчиков и подрядчиков</li> <li>Разработка технической проектной документации в соответствии с ГОСТ, а также по альтернативным отраслевым стандартам (включая зарубежные)</li> <li>Формализация функциональных и нефункциональных требований на доработку / внедрение информационных систем и их интеграцию</li> <li>Опыт работы с технической документацией (спецификации, технические требования, технические задания, описания интерфейсов API)</li> <li>Написание технических заданий, спецификаций взаимодействия компонентов и подобных документов</li> <li>Описание выбранного решения с использованием схем, прототипов для однозначного трактования способа решения</li> <li>Поиск решений проблем, возникающих в процессе проектирования функциональности продукта, и внесение предложений по достижению целей</li> <li>Командная работа в рамках матричного управления</li> </ul> <p><strong>Требования</strong></p> <ul> <li>Аккуратность и внимательность</li> <li>Аналитический склад ума, способность к абстрактному мышлению</li> <li>Опыт работы в области разработки промышленного программного обеспечения не менее 3 лет на позициях «Аналитик» или «Системный аналитик»</li> <li>Опыт написания проектной документации и подготовки проектов. Опыт работы с проектными документами большого объёма</li> <li>Опыт разработки функциональных и нефункциональных спецификаций</li> <li>Развитые навыки коллективной работы в проектной команде. Умение искать компромиссы, нести ответственность за принятые решения</li> <li>Умение быстро находить и анализировать информацию в открытых источниках и в документах, регламентирующих деятельность заказчика</li> <li>Знание принципов управления требованиями, методологий проектирования корпоративных решений</li> <li>Знание и опыт применения средств управления требованиями</li> <li>Умение принимать взвешенные решения с учётом их сопровождения и развития в будущем</li> <li>Знание и опыт практического применения UML, владение ГОСТ 19 и 34</li> <li>Опыт применения специализированных методологий и программных средств для построения моделей процессов, данных, объектов (UML обязательно, BPMN желательно)</li> <li>Поддержка в актуальном состоянии документации и управление изменениями</li> </ul> <p><strong>Плюсом было бы:</strong></p> <ul> <li>понимание методик проектирования эргономики и пользовательского интерфейса</li> <li>участие в проектах по интеграции информационных систем</li> </ul> <p>- опыт работы системным аналитиком на проектах в области разработки программного обеспечения или IP- телефонии;</p> <p>- опыт написания проектной документации, спецификаций;</p> <p>- понимание основных процессов и методов работы контактных центров.</p> <strong>Условия:</strong> <ul> <li>достойный уровень дохода (обсуждается по результатам собеседования);</li> <li>работа в большой и профессиональной команде аналитиков;</li> <li>работа удаленная / или в офисе компании.</li> </ul>","https://hh.ru/vacancy/42398304","1","Москва","","","FALSE"
"140000","2021-02-19 10:07:40+00","140000","140000","","42171381","Ведущий бизнес-аналитик","","","RUR","2021-02-19 10:07:40+00","2021-02-19 23:10:58.480831+00","https://api.hh.ru/vacancies/42171381?host=hh.ru","Финансовое Агентство по Сбору Платежей","<p><strong>Обязанности:</strong></p> <p><strong>Основные:</strong></p> <ol> <li>Разработка, оптимизация, изменение бизнес-процессов компании в рамках проектов и отдельных задач.</li> </ol> <ul> <li>Сбор требований бизнес-подразделений</li> <li>Описание бизнес-процессов</li> <li>Передача в ИТ разработку</li> <li>Тестирование разработанных процессов</li> <li>Создание документации по разработанным процессам</li> <li>Сопровождение разработанных процессов на этапе внедрения.</li> </ul> <p>2. Сопровождение внедренных бизнес-процессов</p> <p>3. Настройка бизнес-процессов в BPM системе</p> <p>4. Создание *.html и *.doc шаблонов печатных форм для автоматизированной системы.</p> <p><strong>Требования:</strong></p> <ol> <li>Свободное владение ПО MS Office Professional (Outlook, Excel, Word, Power Point, Visio, Project)</li> <li>Приветствуется опыт работы в сфере проблемных активов</li> <li>Знание и умение применять в работе VBA</li> <li>Исполнительность</li> <li>Коммуникабельность</li> <li>Внимательность и аккуратность</li> </ol> <p><strong>Условия:</strong></p> <ol> <li>Оформление строго по ТК, &quot;белая&quot; заработная плата</li> <li>ДМС после полугода работы в организации</li> <li>Корпоративное обучение</li> <li>Дружный коллектив</li> <li>Удобный офис (Набережная Тараса Шевченко д.23А, сектор 1, 5 этаж. Башня 2000)</li> </ol> <p> </p>","https://hh.ru/vacancy/42171381","1","Москва","","","TRUE"
"180000","2021-03-25 06:14:37+00","0","180000","","43241937","Бизнес-аналитик на проект Маркировка","","","RUR","2021-03-25 06:14:37+00","2021-03-28 03:10:09.306292+00","https://api.hh.ru/vacancies/43241937?host=hh.ru","Снежная Королева","<p> </p> <p><strong>Ищем бизнес-аналитика на проект &quot;Маркировка&quot;.</strong></p> <p><strong>Основная задача:</strong></p> <p>Анализ бизнес-процессов и определение требований бизнеса для их автоматизации; моделирование, описание бизнес-процессов в системах Business Studio и Aris (нотации EPC, BPMN), постановка задач разработчикам, планирование функционала решений, участие в тестировании.</p> <p><strong>Обязанности:</strong></p> <ul> <li>Коммуникации с внешними разработчиками системы Маркировки (устная и письменная).</li> <li>Анализ предлагаемых вариантов функционирования системы Маркировки на соответствие внутренним бизнес-процессам и работе внутренней ERP.</li> <li>Анализ разрабатываемого законодательства в области Маркировки товаров и выработка рекомендаций.</li> <li>Анализ бизнес-процессов функционирования системы Маркировки и выработка рекомендаций по изменению внутренних процессов компании.</li> <li>Коммуникации с внутренними заказчиками (устная и письменная).</li> <li>Сбор, анализ и систематизация бизнес -требований на основании общения с внутренними заказчиками.</li> <li>Анализ требований на соответствие действующей ERP, оценка возможности внесения изменений в ERP.</li> <li>Трансформация бизнес-требований в требования для разработки, постановка задач разработчикам.</li> <li>Контроль процессов разработки на соответствие требований внутренних заказчиков, тестирование.</li> <li>Составление документации с требованиями к конечному продукту.</li> <li>Написание пользовательских инструкций.</li> <li>Управление требованиями (хранение и актуализация, контроль за состоянием отдельных функциональных требований по мере степени готовности продукта и корректности из реализации).</li> <li>Проектирование и прототипирование пользовательского интерфейса.</li> <li>Участие в разработке концепции и архитектуры разрабатываемого решения.</li> <li>Проведение экспертизы разных предлагаемых вариантов решения.</li> <li>Участие в приемке и опытной эксплуатации системы.</li> </ul> <p> </p> <strong>Требования:</strong> <ul> <li>Высшее образование.</li> <li>Опыт работы аналитиком а IT сфере от 2-х лет, опыт работы в ритейл будет большим преимуществом.</li> <li>Опыт сбора и формализации требований заказчика (описание функциональных требований, user story, test case).</li> <li>Опыт работы по управлению требованиями.</li> <li>Знание нормативно-технической документации и требований к документированию ПО.</li> <li>Знание принципов разработки ПО (анализ требований, дизайн, разработка, тестирование, техподдержка, др.)</li> <li>Опыт UI/UX прототипирования.</li> <li>Опыт моделирования предметной области (UML, ER) в CASE- средствах.</li> <li>Опыт моделирования бизнес-процессов.</li> <li>Опыт использования систем коллективной работы (Redmine и др.).</li> <li>Отличные коммуникативные навыки, способность к самостоятельной работе, аналитический склад ума, внимание к деталям, умение организованно и точно изъяснять мысли (как письменно, так и устно), обучаемость, ответственность, инициативность.</li> <li>Порядок в документах, знание основных нотаций описания БП.</li> <li> <p>Базовые знания технолоиги разработки web-сервисовЗнание принципов разработки программного обеспечения (анализ требований, дизайн, разработка, тестирование, техподдержка, др.);</p> <p>Опыт UI/UX прототипирования;</p> <p>Опыт моделирования бизнес-процессов;</p> <p>Опыт работы с CRM системами, прототипирование;</p> </li> <li> <p>Владение иностранными языками: English, не ниже уровня (Intermediate), письменный, устный</p> </li> </ul> <p> </p> <strong>Условия:</strong> <ul> <li>Комфортный офис в 5-ти минутах от метро Кутузовская;</li> <li>Оформление по ТК РФ;</li> <li>График работы: 5/2 (с 9.00 до 18.00, в пятницу до 17:00 или с 10.00 до 19.00 в пятницу до 18:00);</li> <li>Официальная заработная плата;</li> <li>Корпоративный тариф на кредитование, страхование;</li> <li>Корпоративные скидки от 30% до 50% на продукцию компании;</li> <li>Компенсация ДМС в зависимости от стажа;</li> <li>Корпоративные спортивные тренировки (бег, йога, растяжка, бассейн, волейбол);</li> <li>Корпоративные скидки на изучение иностранных языков;</li> <li>Профессиональный рост и развитие;</li> <li>Активное обучение (семинары, тренинги).</li> </ul>","https://hh.ru/vacancy/43241937","1","Москва","1","","FALSE"
"180000","2021-03-19 10:22:23+00","160000","200000","","42427956","Бизнес-аналитик","","","RUR","2021-03-19 10:22:23+00","2021-03-22 07:15:39.11335+00","https://api.hh.ru/vacancies/42427956?host=hh.ru","Энкри","<p>В нашу команду требуется Ведущий бизнес - аналитик для участия в проекте по разработке масштабной информационной системы по выделению и анализу структурированной информации из потока текстовых документов.</p> <p>В работе используем гибкую методологию разработки, архитектурные комитеты и обмен опытом, платформы строим на микросервисной архитектуре.</p> <p><strong>Обязанности:</strong></p> <ul> <li>Разработка/доработка/согласование с заказчиком концепции системы в целом и отдельных задач (идентификация объектов - событий, юридических лиц и других типов объектов, выделяемых из текстов, посторонние карт связей объектов, обеспечение гибкого поиска текстов и объектов в рамках системы, частотный анализ упоминания объектов в текстовых коллекция и т.п.);</li> <li>Постановка задач разработчикам, аналитикам, тестировщикам;</li> <li>Ведение документации по ГОСТ, прохождение приемочных испытаний.</li> <li>Проведение презентаций/демонстраций.</li> </ul> <strong>Требования:</strong> <ul> <li>Опыт участия в проектах полного цикла разработки в роли главного/ведущего аналитика. Опыт подготовки документации по ГОСТ 19, 34;</li> <li>Понимание принципов поиска по текстам: индексирование, тонизация, синтаксис языков запросов (например, Lucene, Solr);</li> <li>Понимание интеграции программных модулей в высоконагруженных системах и использования очередей (например, Rabbit MQ, Kafka);</li> <li>Понимание основ мат. статистики (частотное распределение, корреляция, классификация, кластеризация);</li> <li>Опыт создания макетов UI и использования диаграмм (UML, BPMN, др.);</li> <li>Высокие коммуникативные навыки и устойчивость в конфликтных ситуациях, умение вести переговоры и деловую переписку с Заказчиком.</li> </ul> <p><strong>Приветствуется</strong>:</p> <ul> <li>Опыт участия в работе по выделению информации из текста (text mining);</li> <li>Понимание таких лингвистических терминов, как морфология, омонимия, синсет, главное и придаточное продолжение и т.п.;</li> <li>Опыт программирования.</li> </ul> <strong>Условия:</strong> <ul> <li>Работа в дружном коллективе</li> <li>Официальное оформление</li> <li>Конкурентный уровень оплаты труда</li> <li>Возможность удаленной работы</li> <li>Индивидуальные премии по итогам проектов</li> </ul>","https://hh.ru/vacancy/42427956","1","Москва","","","FALSE"
"132500","2021-02-23 11:42:41+00","100000","165000","","42538359","Бизнес-аналитик","","","RUR","2021-02-23 11:42:41+00","2021-02-23 19:12:57.896511+00","https://api.hh.ru/vacancies/42538359?host=hh.ru","Софт Компани","<p>Компания <strong>Софт Компани</strong> осуществляет свою деятельность <strong>на рынках бизнес-консалтинга и информационных технологий.</strong></p> <p>Мы принимаем участие в проектах российского уровня. Наши сотрудники работают в нескольких городах РФ, головной офис компании - в Москве.</p> <p>Наши клиенты - крупные государственные и частные организации: <strong>Пенсионный фонд Российской Федерации, Банк России, РОСНЕФТЬ, РЖД </strong>и другие<strong>.</strong></p> <p>Сейчас мы ищем в свою команду <strong>Бизнес-аналитика.</strong></p> <p><strong>Обязанности:</strong></p> <ul> <li>Сопровождение на 2-й линии поддержки информационно аналитической системы на платформе Cognos BI;</li> <li>Анализ предметной области в части пенсионного страхования;</li> <li>Глубокий анализ инцидентов, связанных с ошибками в преднастроенных отчетах, в т.ч. путем изучения исходных данных в СУБД;</li> <li>Выявление требований по запросам на изменения;</li> <li>Подготовка оперативных отчетов в конструкторе отчетов;</li> <li>Постановка задач на 3 линию поддержки на адаптацию/доработку алгоритмов и процедур обработки данных/документов/запросов при изменениях, выявленных в процессе эксплуатации;</li> <li>адаптация пользовательских интерфейсов в части добавления (изменения или оптимизации) фильтров списочных форм (грид) и экранных форм/полей;</li> <li>Формирование базы знаний;</li> <li>Участие в тестировании релизов в среде разработки.</li> </ul> <strong>Требования:</strong> <ul> <li>Навыки построения отчетов в BI системах понимание принципов многомерного анализа;</li> <li>Базовые знания SQL;</li> <li>Знание Congos BI;</li> <li>Умение разобраться в структуре баз данных, а также в sql коде ETL и процедурах.</li> </ul> <p><strong>Желательно:</strong></p> <ul> <li>Иметь опыт работы с госзаказчиком;</li> <li>Иметь опыт работы с ФЗ и другими государственными нормативными документами.</li> </ul> <strong>Условия:</strong> <ul> <li>Оформление по ТК РФ, белая заработная плата от 100 000 до 165 000 руб.;</li> <li>Премиальные вознаграждения (13-я зарплата);</li> <li>Участие в социально значимом проекте для страны;</li> <li>Интересные карьерные и профессиональные возможности;</li> <li>Работа в офисе и на территории заказчика;</li> <li>Комфортабельный офис ст. м. Сокол (5 минут пешком);</li> <li>Режим работы с 08:00 до 17:00 или с 11:00 до 20:00;</li> <li>Сокращенный рабочий день по пятницам (на 1 час).</li> </ul>","https://hh.ru/vacancy/42538359","1","Москва","","","FALSE"
