"Средняя зарплата","published_at","salary_from Замена","salary_to Замена","дата без времени","id","name","has_test","response_letter_required","salary_currency","created_at","parsed_at","url","employer_name","description","alternate_url","area_id","area_name","salary_from Заменен","salary_to Заменен","salary_gross"
"41000","2020-03-18 08:35:13+00","30000","52000","","36258236","Младший бизнес-аналитик / Стажер","","","RUR","2020-03-18 08:35:13+00","2020-03-19 06:57:49.104514+00","https://api.hh.ru/vacancies/36258236?host=hh.ru","К2 Консалт","<p><strong>Описание</strong>:</p> <p>Компания основана в 2003 году командой профессионалов из автомобильной индустрии со специализацией на реинжиниринге бизнес-процессов и внедрении программных продуктов SAP в автомобильной отрасли в России и за рубежом. Сегодня в компании работают более 70-ти специалистов в двух офисах в Москве и Санкт-Петербурге. Среди наших основных клиентов нужно отметить: Inchcape PLC, Mercedes-Benz, Volvo, MAN Truck and Buses, где мы внедряем и поддерживаем CRM, индустриальные решения и облачные решения SAP. Помимо этого, компания успешно реализует собственные разработки с применением новых практик в части облачных технологий и IT.</p> <p>В связи с реализацией новых проектов мы ищем в команду технически подкованных начинающих специалистов, готовых к достижению амбициозных целей, активному росту и развитию вместе с коллективом компании К2 Консалт.</p> <p>Компания активно занимается обучением сотрудников и обеспечивает их всем необходимым для получения и закрепления экспертизы в выбраной сфере деятельности.</p> <p> </p> <p><strong>Обязанности:</strong></p> <ul> <li>Анализ бизнес процессов клиентов</li> <li>Описание бизнес-процессов, подготовка проектной документации</li> <li>Анализ функциональности систем SAP</li> <li>Изучение лучших мировых бизнес практик</li> <li>Проведение GAP анализа</li> <li>Постановка задач по настройке и разработке систем</li> <li>Сбор информации о новых продуктах и возможностях на базе решений SAP</li> <li>Поиск инновационных решений</li> <li>Анализ рынка потенциальных клиентов</li> <li>Участие в разработке архитектуры проекта и в проектировании решений</li> <li>Помощь в настройке решений SAP</li> <li>Обучение пользователей</li> </ul> <p> </p> <p><strong>Требования:</strong></p> <ul> <li>Наличие стажировки / опыта работы до 1 года на аналогичной роли будет преимуществом</li> <li>Высшее техническое образование</li> <li>Начальные навыки анализа бизнес процессов</li> <li>Умение раскладывать задачу на составные элементы</li> <li>Умение планировать собственное время</li> <li>Способность эффективно работать в условиях сжатых сроков и стресса</li> <li>Готовность работать в команде, обмениваться опытом и поддерживать коллег</li> <li>Проявление инициативы, мы всегда рады новым идеям и готовы их реализовывать</li> <li>Опытный пользователь MS Office</li> <li>Умение эффективно и наглядно представлять информацию</li> </ul> <p> </p> <p><strong>Условия:</strong></p> <ul> <li>Работа в офисе на ст. метро Коломенская</li> <li>Конкурентоспособная заработная плата</li> <li>Бонусная программа</li> <li>ДМС после прохождения испытательного срока</li> <li>Участие в регулярных тренингах и сертификациях</li> <li>Индивидуальные условия обсуждаются по результатам интервью</li> </ul>","https://hh.ru/vacancy/36258236","1","Москва","","","TRUE"
"27500","2020-03-13 07:03:25+00","25000","30000","","35870190","Помощник бизнес-аналитика","","","RUR","2020-03-13 07:03:25+00","2020-03-16 02:30:34.895917+00","https://api.hh.ru/vacancies/35870190?host=hh.ru","Камтор","<p>Мы занимаемся IT-разработкой, сотрудничаем с зарубежными и российскими бизнесами и ведем собственные проекты.</p> <p>Мы всегда идем в ногу со временем и разрабатываем проекты с использованием самых популярных инновационных технологий – от блокчейна до виртуальной реальности и искусственного интеллекта.</p> <p>Наша команда разбросана по разным городам, и в работе мы руководствуемся Agile-подходом и используем методологии Scrum и Kanban.</p> <p>Мы ищем целеустремленного коллегу БЕЗ опыта в области аналитики, но заинтересованного в развитии, нацеленного быстро обучиться и получить востребованную профессию.</p> <p>Если ты хочешь научиться описывать и анализировать бизнес-процессы, изучать новые стартапы и перенять опыт успешных предпринимателей, прокачать презентационные навыки и стать в итоге профессионалом высокого уровня - добро пожаловать в нашу команду!</p> <p><strong>Перед тобой будут стоять следующие задачи:</strong></p> <ul> <li>Проводить детальный сбор данных и анализ стартапов в открытых русско- и англоязычных источниках;</li> <li>Описывать стартапы по различным критериям;</li> <li>Предоставлять данные в виде сводного отчета руководителю.</li> </ul> <p><strong>Мы ждем от тебя: </strong></p> <ul> <li>Аналитическое мышление;</li> <li>Ответственный подход к работе, высокий уровень самоорганизации;</li> <li>Умение грамотно и четко излагать свои мысли;</li> <li>Обязательно знание английского языка (проверяется на собеседовании!).</li> </ul> <p><strong>Предлагаем следующие условия:</strong></p> <ul> <li>Удаленная работа, полный 8-часовой рабочий день, 5/2 (если Вы еще обучаетесь, то сможете отпрашиваться на пары);</li> <li>Стабильная выплата з/п 2 раза в месяц;</li> <li>Необходимость установки на рабочий компьютер программы-трекера рабочего времени.</li> </ul> <p><em>В сопроводительном письме напишите, с какими задачами по сбору и анализу данных вам приходилось встречаться, и как вы их выполнили.</em></p>","https://hh.ru/vacancy/35870190","1","Москва","","","FALSE"
"175000","2020-03-19 14:05:22+00","150000","200000","","35966461","Системный аналитик (бизнес-аналитик)","","","RUR","2020-03-19 14:05:22+00","2020-03-20 06:57:27.676056+00","https://api.hh.ru/vacancies/35966461?host=hh.ru","КЭШОФФ","<p><strong>CASHOFF</strong> – международная fintech-компания, основанная в 2013 году. Компания разрабатывает сервисы импорта и анализа транзакционных данных, а также решения для привлечения и удержания клиентов. Основными клиентами Cashoff являются крупные банки и производители товаров.В 2017 году компания CASHOFF вошла в список десяти лучших fintech-компаний по версии Deloitte.</p> <p>В 2019 году компания стала лауреатом престижной международной премии Global Banking &amp; Finance Awards® в номинации &quot;Лучший поставщик технологий для цифрового банкинга&quot;.Компания является резидентом научно-технологических центров Сколково (Россия), Level39 (Великобритания) и Cyberport (Гонконг).</p> <p><strong>Обязанности:</strong></p> <ul> <li>Сбор, формализация и согласование требований заказчика;</li> <li>Разработка технических заданий, бизнес требований, проектной документации, тендерной документации, пользовательской документации;</li> <li>Постановка задач для разработки, приемка результатов работ;</li> <li>Анализ рынка конкурентных предложений;</li> <li>Участие в подготовке коммерческих предложений и презентаций.</li> </ul> <p><strong>Требования:</strong></p> <ul> <li>Высшее техническое образование;</li> <li> <p>Знание банковских технологий и бизнес процессов;</p> </li> <li> <p>Знание основ программирования и разработки ПО;</p> </li> <li> <p>Понимание технологии реляционных БД;</p> </li> <li> <p>Опыт работы в банках в качестве системного-или бизнес-аналитика;</p> </li> <li> <p>Опыт сбора и согласования требований с Заказчиком (внутренним или внешним);</p> </li> <li> <p>Опыт разработки регламентов и методологических документов, технических заданий, BRD, RFP/RFI, тендерной документации, проектной документации, пользовательской документации;</p> </li> <li> <p>Опыт подготовки презентаций и коммерческих предложений.</p> </li> </ul> <p>А чтобы вам было максимально комфортно развиваться в нашей компании, мы предлагаем:</p> <ul> <li>Классную команду, и это не пустые слова!</li> <li>Новые задачи и вызовы. Мы работаем над интересными проектами и с удовольствием делимся опытом и знаниями. А если внутреннего обучения недостаточно, то Вы сможете выбрать необходимые курсы вовне.</li> <li>Обучение английскому в офисе. Благодаря этому Вы легко сможете найти общий язык с коллегами из Лондона или Гонконга, а потом полететь туда в командировку и поразить их чистотой произношения:)</li> <li>Удобный график, где Вы сами определяете для себя режим работы. Долой пробки!</li> <li>Все преимущества официального трудоустройства (отпуска, больничные, и т.д.). Если верить рекламе, то белая зарплата поможет нам в будущем.</li> </ul>","https://hh.ru/vacancy/35966461","1","Москва","","","FALSE"
"150000","2020-03-19 08:26:18+00","0","150000","","35957694","Бизнес-аналитик","","","RUR","2020-03-19 08:26:18+00","2020-03-19 14:57:41.515897+00","https://api.hh.ru/vacancies/35957694?host=hh.ru","BestDoctor","<p><strong>Кто мы</strong></p> <p><strong>BestDoctor</strong> — медицинская компания, которая разрабатывает новые высокотехнологичные страховые и сервисные продукты как B2B, так и B2C.</p> <p><strong>BestDoctor</strong> существует четыре года и уже занимает второе место по числу пользователей среди InsurTech компаний в Европе.</p> <p>Миссия <strong>BestDoctor</strong> — делать медицину доступной с помощью технологий и данных, чтобы жизнь людей становилась лучше, здоровее и счастливее.</p> <p><strong>BestDoctor</strong> выстраивает успешную бизнес-структуру, главный в которой человек, который пользуется медицинскими услугами.</p> <p><strong>BestDoctor</strong> формирует новую бизнес-модель на рынке медицинского страхования. В Европе действуют только четыре проекта InsurTech. Один из них — это <strong>BestDoctor</strong>.</p> <p>Мы уже способны удовлетворить потребность в качественном медицинском сервисе и стремимся к тому, чтобы <strong>BestDoctor</strong> стал частью стиля жизни, помогая нам всем оставаться здоровыми.</p> <p> </p> <p> </p> <p>Обязанности:</p> <p>Бизнес аналитик занимается расчетом и мониторингом основных показателей бизнеса. Формулирует метрики и планирует исследования необходимые для проверки продуктовых гипотез.</p> <ul> <li>Наглядно представлять информацию о показателях бизнеса;</li> <li>Аналитика, построение регулярных отчетов;</li> <li>Проведение тестов, оценка результатов;</li> <li>Взаимодействие с другими подразделениями компании (риски, продажи, финансы);</li> <li>Воплощать идеи в жизнь, ставить ТЗ для IT.</li> </ul> <p>Требования:</p> <ul> <li>Опыт анализа данных от 1 года;</li> <li>Законченное высшее техническое образование (предпочтительней МГУ, МФТИ, ВШЭ, СПБгУ);</li> <li>Умение работать с большими объемами данных;</li> <li>Опыт работы с SQL, владение инструментами анализа данных (Python);</li> <li>Знание математической статистики и теории вероятности.</li> </ul> <p>Будет плюсом:</p> <ul> <li>Знание ключевых метрик страхования;</li> <li>Опыт работы в рисках в банковской / страховой индустрии;</li> <li>ML Python.</li> </ul> <p><strong>Почему с нами круто:</strong></p> <ul> <li>Работаем по гибкому графику, для нас главное — результат;</li> <li>Отправляем на конференции и митапы;</li> <li>Мы начали как стартап, но превращаемся в крупнейшего игрока на рынке медицинского страхования.</li> <li>Те, кто приходят сейчас, попадают в мощный поток роста команд. Если ты наш человек, то через полгода можешь существенно вырасти в компании, которая занимает второе место в Европе в своем сегементе.</li> <li>В нашей команде только талантливые и мотивированные люди, мы дорожим каждым.</li> <li>У вас будет необходимое для работы железо;</li> <li>Вы получите медицинское обслуживание через систему BestDoctor. И это в разы лучше, чем стандартный ДМС :)</li> <li>Вы будете работать в уютном офисе в 10 минутах пешком от метро Парк Победы, в феврале мы переезжаем в крутой лофт у метро Савеловская;</li> <li>Мы предоставляем скидки на занятия английским языком, фитнес, кино и путешествия. А еще у нас есть крутая библиотека, которая пополняется каждую неделю.</li> </ul>","https://hh.ru/vacancy/35957694","1","Москва","1","","FALSE"
"150000","2020-04-25 11:52:31+00","0","150000","","36389701","Бизнес-аналитик","","","RUR","2020-04-25 11:52:31+00","2020-04-26 10:57:37.065903+00","https://api.hh.ru/vacancies/36389701?host=hh.ru","СКАЙТРЭК","<p><strong>Скайтрэк </strong>(skytracking.ru) – российская инновационная компания, резидент Инновационного центра Сколково, разработчик - комплексной платформы обеспечения безопасности и интеллектуального доступа на базе средств машинного обучения, искусственного интеллекта, средств обработки видеопотока SkyTracking Security (STS). Платформа SkyTracking Security представляет собой набор решений, позволяющих реализовать облачное видеонаблюдение, а также организовать мониторинг безопасности объекта (в том числе на транспорте) на базе риск – ориентированного подхода с автоматизированным распознаванием в видеопотоке реальных и потенциальных угроз на объекте наблюдения (инцидентов).</p> <p>Мы ищем в команду проекта бизнес - аналитика для участия в разработке нового функционала Платформы, сопровождения и развития текущего, а также сопровождению проектов по внедрению SkyTracking Security.</p> <p>Мы заинтересованы в сотрудничестве с молодым, амбициозным специалистом или с состоявшимся профессионалом с опытом участия в проектах разработки, внедрения и сопровождения зарубежных и/или отечественных многопользовательских систем автоматизации, web-приложений, мобильных приложений в качестве консультанта/аналитика.</p> <p><strong>БАЗОВЫЕ ТРЕБОВАНИЯ ДЛЯ НАЧАЛА РАЗГОВОРА</strong></p> <ul> <li>Высшее образование (техническое/экономическое);</li> <li>Понимание принципов и подходов организационного консалтинга (обследование, формализация процессов, анализ, рекомендации);</li> <li>Опыт работы в проектах реинжиниринга БП, ИТ-консалтинга,организационной трансформации, автоматизированных систем управления;</li> <li>Аналитическое мышление, системный подход;</li> <li>Опыт подготовки Технических требований, Технических заданий, Отчетов, Презентаций;</li> <li>Опыт работы с прикладными пакетами для проектирования бизнес-процессов в нотации BPMN;</li> <li>Уверенное владение Word, Excel, Power Point;</li> <li>Создание SQL запросов;</li> <li>Ответственность;</li> <li>Ориентация на результат.</li> </ul> <p><strong>ОПЫТ. ДОПОЛНИТЕЛЬНЫЕ НАВЫКИ И ЗНАНИЯ</strong></p> <ul> <li>Опыт управление проектами;</li> <li>Опыт реализации проектов внедрения систем класса BI/ERP/EAM/CRM;</li> <li>Опыт реализации проектов внедрения систем видеоаналитики;</li> <li>Опыт реализации проектов разработки web-приложений и мобильных приложений;</li> <li>Формирование требований к пользовательскому интерфейсу, проектирование интерфейса (совместно с UI/UX-дизайнерами), анализ пользовательского опыта и поведения.</li> </ul> <p><strong>ЗАДАЧИ</strong></p> <ul> <li>Анализ функциональной области и формирование заданий на разработку и внедрение систем интеллектуального мониторинга безопасности, порталов предоставления облачных сервисов;</li> <li>Анализ функциональной области и формирование требований к разработке мобильных приложений;</li> <li>Подготовка проектной документации (инструкций, регламентов, функциональных требований на разработку);</li> <li>Функциональное тестирование систем. Проверка на соответствие заданию;</li> <li>Взаимодействие с командой разработчиков системы (постановка задач в Jira, контроль выполнения, тестирование, ввод в эксплуатацию);</li> <li>Взаимодействие с функциональным заказчиком (обследование бизнес - процессов, презентация продуктов).</li> </ul> <p><strong>УСЛОВИЯ РАБОТЫ</strong></p> <ul> <li>Период привыкания (испытания) – 3 месяца;</li> <li>Премии/Компенсации проезда, парковки, питания;</li> <li>Развитие в режиме 24/7 с охватом 360 градусов;</li> <li>Свежий воздух Сколково.</li> </ul> <p> </p>","https://hh.ru/vacancy/36389701","1","Москва","1","","FALSE"
